     40 sp|P61168|DRD2_MOUSE	sp|P61168|DRD2_MOUSE D(2) dopamine receptor OS=Mus musculus OX=10090 GN=Drd2 PE=1 SV=2
     40 sp|P61169|DRD2_RAT	sp|P61169|DRD2_RAT D(2) dopamine receptor OS=Rattus norvegicus OX=10116 GN=Drd2 PE=1 SV=1
     58 sp|P61752|HRH2_PONPY	sp|P61752|HRH2_PONPY Histamine H2 receptor OS=Pongo pygmaeus OX=9600 GN=HRH2 PE=3 SV=1
     44 sp|P61755|CCR5_LOPAT	sp|P61755|CCR5_LOPAT C-C chemokine receptor type 5 OS=Lophocebus aterrimus OX=75566 GN=CCR5 PE=3 SV=1
     42 sp|P61756|CCR5_PONAB	sp|P61756|CCR5_PONAB C-C chemokine receptor type 5 OS=Pongo abelii OX=9601 GN=CCR5 PE=3 SV=1
     42 sp|P61757|CCR5_SEMEN	sp|P61757|CCR5_SEMEN C-C chemokine receptor type 5 OS=Semnopithecus entellus OX=88029 GN=CCR5 PE=3 SV=1
     12 sp|P61793|LPAR1_MOUSE	sp|P61793|LPAR1_MOUSE Lysophosphatidic acid receptor 1 OS=Mus musculus OX=10090 GN=Lpar1 PE=1 SV=1
     12 sp|P61794|LPAR1_RAT	sp|P61794|LPAR1_RAT Lysophosphatidic acid receptor 1 OS=Rattus norvegicus OX=10116 GN=Lpar1 PE=1 SV=1
     42 sp|P61813|CCR5_MACMU	sp|P61813|CCR5_MACMU C-C chemokine receptor type 5 OS=Macaca mulatta OX=9544 GN=CCR5 PE=2 SV=1
     42 sp|P61814|CCR5_MACFA	sp|P61814|CCR5_MACFA C-C chemokine receptor type 5 OS=Macaca fascicularis OX=9541 GN=CCR5 PE=2 SV=1
     42 sp|P61815|CCR5_MACNE	sp|P61815|CCR5_MACNE C-C chemokine receptor type 5 OS=Macaca nemestrina OX=9545 GN=CCR5 PE=3 SV=1
     44 sp|P68269|CCR5_PAPAN	sp|P68269|CCR5_PAPAN C-C chemokine receptor type 5 OS=Papio anubis OX=9555 GN=CCR5 PE=2 SV=1
     44 sp|P68270|CCR5_PAPHA	sp|P68270|CCR5_PAPHA C-C chemokine receptor type 5 OS=Papio hamadryas OX=9557 GN=CCR5 PE=3 SV=1
      6 sp|P69332|US28_HCMVA	sp|P69332|US28_HCMVA G-protein coupled receptor homolog US28 OS=Human cytomegalovirus (strain AD169) OX=10360 GN=US28 PE=1 SV=1
      6 sp|P69333|US28_HCMVT	sp|P69333|US28_HCMVT G-protein coupled receptor homolog US28 OS=Human cytomegalovirus (strain Towne) OX=10363 GN=US28 PE=1 SV=1
     49 sp|P70031|CCKAR_XENLA	sp|P70031|CCKAR_XENLA Cholecystokinin receptor OS=Xenopus laevis OX=8355 GN=cckar PE=2 SV=1
     10 sp|P70115|ACTHR_MESAU	sp|P70115|ACTHR_MESAU Adrenocorticotropic hormone receptor OS=Mesocricetus auratus OX=10036 GN=MC2R PE=2 SV=1
     38 sp|P70174|HRH1_MOUSE	sp|P70174|HRH1_MOUSE Histamine H1 receptor OS=Mus musculus OX=10090 GN=Hrh1 PE=1 SV=2
      7 sp|P70536|OXYR_RAT	sp|P70536|OXYR_RAT Oxytocin receptor OS=Rattus norvegicus OX=10116 GN=Oxtr PE=1 SV=2
     46 sp|P70585|GPR19_RAT	sp|P70585|GPR19_RAT Probable G-protein coupled receptor 19 OS=Rattus norvegicus OX=10116 GN=Gpr19 PE=2 SV=2
      4 sp|P70596|MC4R_RAT	sp|P70596|MC4R_RAT Melanocortin receptor 4 OS=Rattus norvegicus OX=10116 GN=Mc4r PE=2 SV=1
     39 sp|P70612|CXCR1_RAT	sp|P70612|CXCR1_RAT C-X-C chemokine receptor type 1 OS=Rattus norvegicus OX=10116 GN=Cxcr1 PE=3 SV=1
     20 sp|P70658|CXCR4_MOUSE	sp|P70658|CXCR4_MOUSE C-X-C chemokine receptor type 4 OS=Mus musculus OX=10090 GN=Cxcr4 PE=1 SV=2
     51 sp|P79113|NPY2R_BOVIN	sp|P79113|NPY2R_BOVIN Neuropeptide Y receptor type 2 OS=Bos taurus OX=9913 GN=NPY2R PE=2 SV=1
     43 sp|P79148|ADRB1_CANLF	sp|P79148|ADRB1_CANLF Beta-1 adrenergic receptor OS=Canis lupus familiaris OX=9615 GN=ADRB1 PE=3 SV=1
      6 sp|P79166|MSHR_HORSE	sp|P79166|MSHR_HORSE Melanocyte-stimulating hormone receptor OS=Equus caballus OX=9796 GN=MC1R PE=3 SV=2
     29 sp|P79175|C5AR1_GORGO	sp|P79175|C5AR1_GORGO C5a anaphylatoxin chemotactic receptor 1 OS=Gorilla gorilla gorilla OX=9595 GN=C5AR1 PE=3 SV=2
     26 sp|P79176|FPR1_GORGO	sp|P79176|FPR1_GORGO fMet-Leu-Phe receptor (Fragment) OS=Gorilla gorilla gorilla OX=9595 GN=FPR1 PE=3 SV=1
     24 sp|P79177|FPR2_GORGO	sp|P79177|FPR2_GORGO N-formyl peptide receptor 2 (Fragment) OS=Gorilla gorilla gorilla OX=9595 GN=FPR2 PE=3 SV=1
     24 sp|P79178|FPR3_GORGO	sp|P79178|FPR3_GORGO N-formyl peptide receptor 3 (Fragment) OS=Gorilla gorilla gorilla OX=9595 GN=FPR3 PE=3 SV=1
     24 sp|P79188|C5AR1_MACMU	sp|P79188|C5AR1_MACMU C5a anaphylatoxin chemotactic receptor 1 (Fragment) OS=Macaca mulatta OX=9544 GN=C5AR1 PE=3 SV=1
     28 sp|P79189|FPR1_MACMU	sp|P79189|FPR1_MACMU fMet-Leu-Phe receptor (Fragment) OS=Macaca mulatta OX=9544 GN=FPR1 PE=3 SV=1
     20 sp|P79190|FPR2_MACMU	sp|P79190|FPR2_MACMU N-formyl peptide receptor 2 (Fragment) OS=Macaca mulatta OX=9544 GN=FPR2 PE=3 SV=1
     25 sp|P79191|FPR3_MACMU	sp|P79191|FPR3_MACMU N-formyl peptide receptor 3 (Fragment) OS=Macaca mulatta OX=9544 GN=FPR3 PE=3 SV=1
     38 sp|P79217|NPY6R_RABIT	sp|P79217|NPY6R_RABIT Neuropeptide Y receptor type 6 OS=Oryctolagus cuniculus OX=9986 GN=NPY6R PE=2 SV=1
     64 sp|P79218|NK2R_RABIT	sp|P79218|NK2R_RABIT Substance-K receptor OS=Oryctolagus cuniculus OX=9986 GN=TACR2 PE=2 SV=1
     21 sp|P79234|C5AR1_PONPY	sp|P79234|C5AR1_PONPY C5a anaphylatoxin chemotactic receptor 1 (Fragment) OS=Pongo pygmaeus OX=9600 GN=C5AR1 PE=3 SV=1
     28 sp|P79235|FPR1_PONPY	sp|P79235|FPR1_PONPY fMet-Leu-Phe receptor (Fragment) OS=Pongo pygmaeus OX=9600 GN=FPR1 PE=3 SV=1
     21 sp|P79236|FPR2_PONPY	sp|P79236|FPR2_PONPY N-formyl peptide receptor 2 (Fragment) OS=Pongo pygmaeus OX=9600 GN=FPR2 PE=3 SV=1
     28 sp|P79237|FPR3_PONPY	sp|P79237|FPR3_PONPY N-formyl peptide receptor 3 (Fragment) OS=Pongo pygmaeus OX=9600 GN=FPR3 PE=3 SV=1
     29 sp|P79240|C5AR1_PANTR	sp|P79240|C5AR1_PANTR C5a anaphylatoxin chemotactic receptor 1 OS=Pan troglodytes OX=9598 GN=C5AR1 PE=3 SV=2
     24 sp|P79241|FPR1_PANTR	sp|P79241|FPR1_PANTR fMet-Leu-Phe receptor (Fragment) OS=Pan troglodytes OX=9598 GN=FPR1 PE=3 SV=1
     23 sp|P79242|FPR2_PANTR	sp|P79242|FPR2_PANTR N-formyl peptide receptor 2 (Fragment) OS=Pan troglodytes OX=9598 GN=FPR2 PE=3 SV=1
     30 sp|P79243|FPR3_PANTR	sp|P79243|FPR3_PANTR N-formyl peptide receptor 3 (Fragment) OS=Pan troglodytes OX=9598 GN=FPR3 PE=3 SV=1
     49 sp|P79250|5HT1B_CANLF	sp|P79250|5HT1B_CANLF 5-hydroxytryptamine receptor 1B OS=Canis lupus familiaris OX=9615 GN=HTR1B PE=2 SV=2
     30 sp|P79266|GASR_BOVIN	sp|P79266|GASR_BOVIN Gastrin/cholecystokinin type B receptor OS=Bos taurus OX=9913 GN=CCKBR PE=2 SV=1
     19 sp|P79291|OPRD_PIG	sp|P79291|OPRD_PIG Delta-type opioid receptor (Fragment) OS=Sus scrofa OX=9823 GN=OPRD1 PE=1 SV=1
     52 sp|P79292|OPRX_PIG	sp|P79292|OPRX_PIG Nociceptin receptor OS=Sus scrofa OX=9823 GN=OPRL1 PE=2 SV=1
     48 sp|P79350|OPRM_BOVIN	sp|P79350|OPRM_BOVIN Mu-type opioid receptor OS=Bos taurus OX=9913 GN=OPRM1 PE=2 SV=2
     11 sp|P79393|PI2R_BOVIN	sp|P79393|PI2R_BOVIN Prostacyclin receptor OS=Bos taurus OX=9913 GN=PTGIR PE=3 SV=1
     16 sp|P79394|CXCR4_MACMU	sp|P79394|CXCR4_MACMU C-X-C chemokine receptor type 4 OS=Macaca mulatta OX=9544 GN=CXCR4 PE=2 SV=1
      1 sp|P79399|5HT1B_PIG	sp|P79399|5HT1B_PIG 5-hydroxytryptamine receptor 1B (Fragment) OS=Sus scrofa OX=9823 GN=HTR1B PE=2 SV=1
     11 sp|P79400|5HT1D_PIG	sp|P79400|5HT1D_PIG 5-hydroxytryptamine receptor 1D (Fragment) OS=Sus scrofa OX=9823 GN=HTR1D PE=2 SV=1
     37 sp|P79748|5HT1D_TAKRU	sp|P79748|5HT1D_TAKRU 5-hydroxytryptamine receptor 1D OS=Takifugu rubripes OX=31033 GN=htr1d PE=3 SV=1
     82 sp|P79756|OPSD_GAMAF	sp|P79756|OPSD_GAMAF Rhodopsin OS=Gambusia affinis OX=33528 GN=rho PE=1 SV=1
     21 sp|P79763|FSHR_CHICK	sp|P79763|FSHR_CHICK Follicle-stimulating hormone receptor OS=Gallus gallus OX=9031 GN=FSHR PE=2 SV=1
     31 sp|P79785|AGTR1_CHICK	sp|P79785|AGTR1_CHICK Type-1 angiotensin II receptor OS=Gallus gallus OX=9031 GN=AGTR1 PE=2 SV=1
     83 sp|P79798|OPSD_MYRBE	sp|P79798|OPSD_MYRBE Rhodopsin (Fragment) OS=Myripristis berndti OX=47700 GN=rho PE=2 SV=1
     83 sp|P79807|OPSD_MYRVI	sp|P79807|OPSD_MYRVI Rhodopsin (Fragment) OS=Myripristis violacea OX=47701 GN=rho PE=2 SV=1
     83 sp|P79808|OPSD_NEOAR	sp|P79808|OPSD_NEOAR Rhodopsin (Fragment) OS=Neoniphon argenteus OX=47704 GN=rho PE=2 SV=1
     82 sp|P79809|OPSD_NEOAU	sp|P79809|OPSD_NEOAU Rhodopsin (Fragment) OS=Neoniphon aurolineatus OX=47705 GN=rho PE=2 SV=1
     83 sp|P79812|OPSD_NEOSA	sp|P79812|OPSD_NEOSA Rhodopsin OS=Neoniphon sammara OX=47706 GN=rho PE=2 SV=1
     82 sp|P79848|OPSD_POERE	sp|P79848|OPSD_POERE Rhodopsin OS=Poecilia reticulata OX=8081 GN=rho PE=2 SV=1
     83 sp|P79863|OPSD_LEUER	sp|P79863|OPSD_LEUER Rhodopsin OS=Leucoraja erinacea OX=7782 GN=rho PE=2 SV=1
     83 sp|P79898|OPSD_SARDI	sp|P79898|OPSD_SARDI Rhodopsin OS=Sargocentron diadema OX=47709 GN=rho PE=2 SV=1
     83 sp|P79901|OPSD_SARMI	sp|P79901|OPSD_SARMI Rhodopsin (Fragment) OS=Sargocentron microstoma OX=47710 GN=rho PE=2 SV=1
     83 sp|P79902|OPSD_SARPU	sp|P79902|OPSD_SARPU Rhodopsin (Fragment) OS=Sargocentron punctatissimum OX=47711 GN=rho PE=2 SV=1
     83 sp|P79903|OPSD_SARSP	sp|P79903|OPSD_SARSP Rhodopsin (Fragment) OS=Sargocentron spiniferum OX=47712 GN=rho PE=2 SV=1
     83 sp|P79911|OPSD_SARTI	sp|P79911|OPSD_SARTI Rhodopsin (Fragment) OS=Sargocentron tiere OX=47713 GN=rho PE=2 SV=1
     82 sp|P79914|OPSD_SARXA	sp|P79914|OPSD_SARXA Rhodopsin (Fragment) OS=Sargocentron xantherythrum OX=47708 GN=rho PE=2 SV=1
     15 sp|P79928|P2RY4_XENLA	sp|P79928|P2RY4_XENLA P2Y purinoceptor 4 OS=Xenopus laevis OX=8355 GN=p2ry4 PE=2 SV=1
     61 sp|P79945|PSP24_XENLA	sp|P79945|PSP24_XENLA High-affinity lysophosphatidic acid receptor OS=Xenopus laevis OX=8355 PE=2 SV=1
     55 sp|P79960|APJA_XENLA	sp|P79960|APJA_XENLA Apelin receptor A OS=Xenopus laevis OX=8355 GN=aplnr-a PE=1 SV=2
     45 sp|P83858|QRFPR_RAT	sp|P83858|QRFPR_RAT Pyroglutamylated RF-amide peptide receptor OS=Rattus norvegicus OX=10116 GN=Qrfpr PE=2 SV=1
     40 sp|P83861|QRFPR_MOUSE	sp|P83861|QRFPR_MOUSE Pyroglutamylated RF-amide peptide receptor OS=Mus musculus OX=10090 GN=Qrfpr PE=2 SV=1
     75 sp|P87365|OPSB_ORYLA	sp|P87365|OPSB_ORYLA Blue-sensitive opsin OS=Oryzias latipes OX=8090 PE=2 SV=1
     79 sp|P87366|OPSG_ORYLA	sp|P87366|OPSG_ORYLA Green-sensitive opsin OS=Oryzias latipes OX=8090 PE=2 SV=1
     82 sp|P87367|OPSR_ORYLA	sp|P87367|OPSR_ORYLA Red-sensitive opsin OS=Oryzias latipes OX=8090 PE=1 SV=1
     78 sp|P87368|OPSV_ORYLA	sp|P87368|OPSV_ORYLA Putative violet-sensitive opsin OS=Oryzias latipes OX=8090 PE=1 SV=1
     82 sp|P87369|OPSD_ORYLA	sp|P87369|OPSD_ORYLA Rhodopsin OS=Oryzias latipes OX=8090 GN=rho PE=1 SV=1
     76 sp|P90680|OPSB_APIME	sp|P90680|OPSB_APIME Opsin, blue-sensitive OS=Apis mellifera OX=7460 GN=BLOP PE=1 SV=2
     74 sp|P91657|OPS5_DROME	sp|P91657|OPS5_DROME Opsin Rh5 OS=Drosophila melanogaster OX=7227 GN=Rh5 PE=2 SV=1
      8 sp|P97266|OPRM_CAVPO	sp|P97266|OPRM_CAVPO Mu-type opioid receptor (Fragment) OS=Cavia porcellus OX=10141 GN=OPRM1 PE=3 SV=1
     50 sp|P97288|5HT4R_MOUSE	sp|P97288|5HT4R_MOUSE 5-hydroxytryptamine receptor 4 OS=Mus musculus OX=10090 GN=Htr4 PE=1 SV=3
     60 sp|P97292|HRH2_MOUSE	sp|P97292|HRH2_MOUSE Histamine H2 receptor OS=Mus musculus OX=10090 GN=Hrh2 PE=2 SV=2
     54 sp|P97295|NPY2R_MOUSE	sp|P97295|NPY2R_MOUSE Neuropeptide Y receptor type 2 OS=Mus musculus OX=10090 GN=Npy2r PE=2 SV=2
     23 sp|P97468|CML1_MOUSE	sp|P97468|CML1_MOUSE Chemokine-like receptor 1 OS=Mus musculus OX=10090 GN=Cmklr1 PE=1 SV=1
     32 sp|P97520|C5AR1_RAT	sp|P97520|C5AR1_RAT C5a anaphylatoxin chemotactic receptor 1 OS=Rattus norvegicus OX=10116 GN=C5ar1 PE=1 SV=1
      2 sp|P97583|BKRB1_RAT	sp|P97583|BKRB1_RAT B1 bradykinin receptor OS=Rattus norvegicus OX=10116 GN=Bdkrb1 PE=2 SV=2
     47 sp|P97639|MCHR1_RAT	sp|P97639|MCHR1_RAT Melanin-concentrating hormone receptor 1 OS=Rattus norvegicus OX=10116 GN=Mchr1 PE=2 SV=4
     34 sp|P97714|ADA1D_MOUSE	sp|P97714|ADA1D_MOUSE Alpha-1D adrenergic receptor OS=Mus musculus OX=10090 GN=Adra1d PE=2 SV=1
     61 sp|P97717|ADA1B_MOUSE	sp|P97717|ADA1B_MOUSE Alpha-1B adrenergic receptor OS=Mus musculus OX=10090 GN=Adra1b PE=1 SV=2
     62 sp|P97718|ADA1A_MOUSE	sp|P97718|ADA1A_MOUSE Alpha-1A adrenergic receptor OS=Mus musculus OX=10090 GN=Adra1a PE=1 SV=3
     10 sp|P97926|OXYR_MOUSE	sp|P97926|OXYR_MOUSE Oxytocin receptor OS=Mus musculus OX=10090 GN=Oxtr PE=2 SV=2
      2 sp|Q00788|V2R_RAT	sp|Q00788|V2R_RAT Vasopressin V2 receptor OS=Rattus norvegicus OX=10116 GN=Avpr2 PE=1 SV=2
     11 sp|Q00991|PAR1_CRILO	sp|Q00991|PAR1_CRILO Proteinase-activated receptor 1 OS=Cricetulus longicaudatus OX=10030 GN=F2R PE=2 SV=2
     44 sp|Q01337|ADA2C_MOUSE	sp|Q01337|ADA2C_MOUSE Alpha-2C adrenergic receptor OS=Mus musculus OX=10090 GN=Adra2c PE=3 SV=1
     40 sp|Q01338|ADA2A_MOUSE	sp|Q01338|ADA2A_MOUSE Alpha-2A adrenergic receptor OS=Mus musculus OX=10090 GN=Adra2a PE=1 SV=2
     43 sp|Q01717|TRFR_RAT	sp|Q01717|TRFR_RAT Thyrotropin-releasing hormone receptor OS=Rattus norvegicus OX=10116 GN=Trhr PE=2 SV=1
     11 sp|Q01718|ACTHR_HUMAN	sp|Q01718|ACTHR_HUMAN Adrenocorticotropic hormone receptor OS=Homo sapiens OX=9606 GN=MC2R PE=1 SV=1
      3 sp|Q01726|MSHR_HUMAN	sp|Q01726|MSHR_HUMAN Melanocyte-stimulating hormone receptor OS=Homo sapiens OX=9606 GN=MC1R PE=1 SV=2
      3 sp|Q01727|MSHR_MOUSE	sp|Q01727|MSHR_MOUSE Melanocyte-stimulating hormone receptor OS=Mus musculus OX=10090 GN=Mc1r PE=2 SV=2
      9 sp|Q01776|GNRHR_MOUSE	sp|Q01776|GNRHR_MOUSE Gonadotropin-releasing hormone receptor OS=Mus musculus OX=10090 GN=Gnrhr PE=2 SV=1
     27 sp|Q02152|5HT2B_MOUSE	sp|Q02152|5HT2B_MOUSE 5-hydroxytryptamine receptor 2B OS=Mus musculus OX=10090 GN=Htr2b PE=1 SV=3
     43 sp|Q02284|5HT1F_MOUSE	sp|Q02284|5HT1F_MOUSE 5-hydroxytryptamine receptor 1F OS=Mus musculus OX=10090 GN=Htr1f PE=2 SV=1
     47 sp|Q03566|TKR1_CAEEL	sp|Q03566|TKR1_CAEEL Probable G-protein coupled receptor tkr-1 OS=Caenorhabditis elegans OX=6239 GN=tkr-1 PE=3 SV=2
     59 sp|Q04573|NPY1R_MOUSE	sp|Q04573|NPY1R_MOUSE Neuropeptide Y receptor type 1 OS=Mus musculus OX=10090 GN=Npy1r PE=1 SV=1
     34 sp|Q04683|CXCR5_MOUSE	sp|Q04683|CXCR5_MOUSE C-X-C chemokine receptor type 5 OS=Mus musculus OX=10090 GN=Cxcr5 PE=1 SV=2
     29 sp|Q05394|FPR1_RABIT	sp|Q05394|FPR1_RABIT fMet-Leu-Phe receptor OS=Oryctolagus cuniculus OX=9986 GN=FPR1 PE=2 SV=1
      7 sp|Q07FZ4|CXCR4_XENTR	sp|Q07FZ4|CXCR4_XENTR C-X-C chemokine receptor type 4 OS=Xenopus tropicalis OX=8364 GN=cxcr4 PE=2 SV=1
     28 sp|Q08520|VK02_SWPVK	sp|Q08520|VK02_SWPVK G-protein coupled receptor homolog K2 OS=Swinepox virus (strain Kasza) OX=10277 GN=K2R PE=3 SV=1
     28 sp|Q09388|ACM2_CAEEL	sp|Q09388|ACM2_CAEEL Muscarinic acetylcholine receptor gar-2 OS=Caenorhabditis elegans OX=6239 GN=gar-2 PE=2 SV=3
      1 sp|Q09502|NPR18_CAEEL	sp|Q09502|NPR18_CAEEL Neuropeptide receptor 18 OS=Caenorhabditis elegans OX=6239 GN=npr-18 PE=2 SV=1
     25 sp|Q09638|NPR15_CAEEL	sp|Q09638|NPR15_CAEEL Neuropeptide receptor 15 OS=Caenorhabditis elegans OX=6239 GN=npr-15 PE=2 SV=3
     40 sp|Q09QM4|GPR17_RAT	sp|Q09QM4|GPR17_RAT Uracil nucleotide/cysteinyl leukotriene receptor OS=Rattus norvegicus OX=10116 GN=Gpr17 PE=2 SV=1
     48 sp|Q0EAB5|5HT1B_HORSE	sp|Q0EAB5|5HT1B_HORSE 5-hydroxytryptamine receptor 1B OS=Equus caballus OX=9796 GN=HTR1B PE=2 SV=1
     50 sp|Q0EAB6|5HT1A_HORSE	sp|Q0EAB6|5HT1A_HORSE 5-hydroxytryptamine receptor 1A OS=Equus caballus OX=9796 GN=HTR1A PE=2 SV=1
     37 sp|Q0GBZ5|OX1R_BOVIN	sp|Q0GBZ5|OX1R_BOVIN Orexin receptor type 1 OS=Bos taurus OX=9913 GN=HCRTR1 PE=2 SV=1
     23 sp|Q0II78|CCRL2_BOVIN	sp|Q0II78|CCRL2_BOVIN Chemokine C-C motif receptor-like 2 OS=Bos taurus OX=9913 GN=CCRL2 PE=2 SV=1
      3 sp|Q0Q460|MSHR_MAMPR	sp|Q0Q460|MSHR_MAMPR Melanocyte-stimulating hormone receptor OS=Mammuthus primigenius OX=37349 GN=MC1R PE=3 SV=1
      1 sp|Q0VAX9|OLF18_MOUSE	sp|Q0VAX9|OLF18_MOUSE Olfactory receptor 18 OS=Mus musculus OX=10090 GN=Olfr18 PE=2 SV=2
     43 sp|Q0VC81|AA3R_BOVIN	sp|Q0VC81|AA3R_BOVIN Adenosine receptor A3 OS=Bos taurus OX=9913 GN=ADORA3 PE=2 SV=1
     29 sp|Q0VDU3|GPR15_MOUSE	sp|Q0VDU3|GPR15_MOUSE G-protein coupled receptor 15 OS=Mus musculus OX=10090 GN=Gpr15 PE=2 SV=2
      4 sp|Q0Z8I9|MC4R_VULVU	sp|Q0Z8I9|MC4R_VULVU Melanocortin receptor 4 OS=Vulpes vulpes OX=9627 GN=MC4R PE=3 SV=1
      1 sp|Q10904|YWO1_CAEEL	sp|Q10904|YWO1_CAEEL Probable G-protein coupled receptor AH9.1 OS=Caenorhabditis elegans OX=6239 GN=AH9.1 PE=1 SV=2
     48 sp|Q13304|GPR17_HUMAN	sp|Q13304|GPR17_HUMAN Uracil nucleotide/cysteinyl leukotriene receptor OS=Homo sapiens OX=9606 GN=GPR17 PE=2 SV=2
     61 sp|Q13585|MTR1L_HUMAN	sp|Q13585|MTR1L_HUMAN Melatonin-related receptor OS=Homo sapiens OX=9606 GN=GPR50 PE=1 SV=3
      1 sp|Q13607|OR2F1_HUMAN	sp|Q13607|OR2F1_HUMAN Olfactory receptor 2F1 OS=Homo sapiens OX=9606 GN=OR2F1 PE=2 SV=2
     52 sp|Q13639|5HT4R_HUMAN	sp|Q13639|5HT4R_HUMAN 5-hydroxytryptamine receptor 4 OS=Homo sapiens OX=9606 GN=HTR4 PE=1 SV=2
     21 sp|Q14330|GPR18_HUMAN	sp|Q14330|GPR18_HUMAN N-arachidonyl glycine receptor OS=Homo sapiens OX=9606 GN=GPR18 PE=1 SV=2
     13 sp|Q14439|GP176_HUMAN	sp|Q14439|GP176_HUMAN G-protein coupled receptor 176 OS=Homo sapiens OX=9606 GN=GPR176 PE=2 SV=1
      2 sp|Q149R9|LPAR5_MOUSE	sp|Q149R9|LPAR5_MOUSE Lysophosphatidic acid receptor 5 OS=Mus musculus OX=10090 GN=Lpar5 PE=2 SV=2
      6 sp|Q15077|P2RY6_HUMAN	sp|Q15077|P2RY6_HUMAN P2Y purinoceptor 6 OS=Homo sapiens OX=9606 GN=P2RY6 PE=1 SV=1
      4 sp|Q15615|OR4D1_HUMAN	sp|Q15615|OR4D1_HUMAN Olfactory receptor 4D1 OS=Homo sapiens OX=9606 GN=OR4D1 PE=2 SV=3
      3 sp|Q15619|OR1C1_HUMAN	sp|Q15619|OR1C1_HUMAN Olfactory receptor 1C1 OS=Homo sapiens OX=9606 GN=OR1C1 PE=2 SV=4
      9 sp|Q15743|OGR1_HUMAN	sp|Q15743|OGR1_HUMAN Ovarian cancer G-protein coupled receptor 1 OS=Homo sapiens OX=9606 GN=GPR68 PE=1 SV=1
     36 sp|Q15760|GPR19_HUMAN	sp|Q15760|GPR19_HUMAN Probable G-protein coupled receptor 19 OS=Homo sapiens OX=9606 GN=GPR19 PE=2 SV=2
     34 sp|Q15761|NPY5R_HUMAN	sp|Q15761|NPY5R_HUMAN Neuropeptide Y receptor type 5 OS=Homo sapiens OX=9606 GN=NPY5R PE=2 SV=2
      2 sp|Q16581|C3AR_HUMAN	sp|Q16581|C3AR_HUMAN C3a anaphylatoxin chemotactic receptor OS=Homo sapiens OX=9606 GN=C3AR1 PE=1 SV=2
     18 sp|Q16950|5HTB1_APLCA	sp|Q16950|5HTB1_APLCA 5-hydroxytryptamine receptor 1 OS=Aplysia californica OX=6500 GN=5HTB1 PE=2 SV=1
     19 sp|Q16951|5HTB2_APLCA	sp|Q16951|5HTB2_APLCA 5-hydroxytryptamine receptor 2 OS=Aplysia californica OX=6500 GN=5HTB2 PE=2 SV=1
     81 sp|Q17053|OPSD_APIME	sp|Q17053|OPSD_APIME Rhodopsin, long-wavelength OS=Apis mellifera OX=7460 PE=1 SV=1
     83 sp|Q17094|OPSD_ALLSU	sp|Q17094|OPSD_ALLSU Rhodopsin (Fragment) OS=Alloteuthis subulata OX=54069 GN=RHO PE=3 SV=1
     57 sp|Q17232|OAR_BOMMO	sp|Q17232|OAR_BOMMO Octopamine receptor OS=Bombyx mori OX=7091 PE=2 SV=1
     28 sp|Q17239|5HTR_BOMMO	sp|Q17239|5HTR_BOMMO 5-hydroxytryptamine receptor OS=Bombyx mori OX=7091 PE=2 SV=1
     82 sp|Q17292|OPSD_CAMAT	sp|Q17292|OPSD_CAMAT Rhodopsin OS=Camponotus atriceps OX=104420 PE=2 SV=1
     82 sp|Q17296|OPSD_CATBO	sp|Q17296|OPSD_CATBO Rhodopsin OS=Cataglyphis bombycinus OX=72790 PE=2 SV=1
      9 sp|Q18007|ACM1_CAEEL	sp|Q18007|ACM1_CAEEL Probable muscarinic acetylcholine receptor gar-1 OS=Caenorhabditis elegans OX=6239 GN=gar-1 PE=2 SV=3
     40 sp|Q18179|NPR11_CAEEL	sp|Q18179|NPR11_CAEEL Putative neuropeptide Y receptor 11 OS=Caenorhabditis elegans OX=6239 GN=npr-11 PE=3 SV=2
     42 sp|Q18775|DOPR4_CAEEL	sp|Q18775|DOPR4_CAEEL Dopamine receptor 4 OS=Caenorhabditis elegans OX=6239 GN=dop-4 PE=2 SV=2
      7 sp|Q18904|NPR8_CAEEL	sp|Q18904|NPR8_CAEEL Probable G-protein coupled receptor npr-8 OS=Caenorhabditis elegans OX=6239 GN=npr-8 PE=3 SV=1
     48 sp|Q19084|OAR2_CAEEL	sp|Q19084|OAR2_CAEEL Tyramine receptor tyra-2 OS=Caenorhabditis elegans OX=6239 GN=tyra-2 PE=2 SV=3
     16 sp|Q19PY9|GNRHR_BOSMU	sp|Q19PY9|GNRHR_BOSMU Gonadotropin-releasing hormone receptor OS=Bos mutus grunniens OX=30521 GN=GNRHR PE=3 SV=1
     83 sp|Q1JPS6|OPN4L_DANRE	sp|Q1JPS6|OPN4L_DANRE Melanopsin-like OS=Danio rerio OX=7955 GN=opn4l PE=2 SV=1
     14 sp|Q1JQB3|GPR4_BOVIN	sp|Q1JQB3|GPR4_BOVIN G-protein coupled receptor 4 OS=Bos taurus OX=9913 GN=GPR4 PE=2 SV=1
     39 sp|Q1LZD0|AA2BR_BOVIN	sp|Q1LZD0|AA2BR_BOVIN Adenosine receptor A2b OS=Bos taurus OX=9913 GN=ADORA2B PE=2 SV=1
     13 sp|Q1RMI1|GP183_BOVIN	sp|Q1RMI1|GP183_BOVIN G-protein coupled receptor 183 OS=Bos taurus OX=9913 GN=GPR183 PE=2 SV=1
     61 sp|Q1RMU8|NPY1R_BOVIN	sp|Q1RMU8|NPY1R_BOVIN Neuropeptide Y receptor type 1 OS=Bos taurus OX=9913 GN=NPY1R PE=2 SV=1
     19 sp|Q1WLP9|CCR9_SHEEP	sp|Q1WLP9|CCR9_SHEEP C-C chemokine receptor type 9 OS=Ovis aries OX=9940 GN=CCR9 PE=2 SV=1
     36 sp|Q1ZY22|CCR5_RABIT	sp|Q1ZY22|CCR5_RABIT C-C chemokine receptor type 5 OS=Oryctolagus cuniculus OX=9986 GN=CCR5 PE=3 SV=1
     31 sp|Q23497|NPR9_CAEEL	sp|Q23497|NPR9_CAEEL Galanin-like G-protein coupled receptor npr-9 OS=Caenorhabditis elegans OX=6239 GN=npr-9 PE=2 SV=1
     30 sp|Q24563|DOPR2_DROME	sp|Q24563|DOPR2_DROME Dopamine receptor 2 OS=Drosophila melanogaster OX=7227 GN=Dop1R2 PE=2 SV=1
     83 sp|Q25157|OPSC1_HEMSA	sp|Q25157|OPSC1_HEMSA Compound eye opsin BCRH1 OS=Hemigrapsus sanguineus OX=40176 PE=2 SV=1
     82 sp|Q25158|OPSC2_HEMSA	sp|Q25158|OPSC2_HEMSA Compound eye opsin BCRH2 OS=Hemigrapsus sanguineus OX=40176 PE=2 SV=1
     59 sp|Q25188|OAR_HELVI	sp|Q25188|OAR_HELVI Octopamine receptor OS=Heliothis virescens OX=7102 PE=2 SV=1
     31 sp|Q25190|5HTR_HELVI	sp|Q25190|5HTR_HELVI 5-hydroxytryptamine receptor OS=Heliothis virescens OX=7102 PE=2 SV=1
     64 sp|Q25321|OAR1_LOCMI	sp|Q25321|OAR1_LOCMI Tyramine receptor 1 OS=Locusta migratoria OX=7004 GN=GCR1 PE=1 SV=1
     64 sp|Q25322|OAR2_LOCMI	sp|Q25322|OAR2_LOCMI Putative tyramine receptor 2 OS=Locusta migratoria OX=7004 GN=GCR2 PE=2 SV=1
     55 sp|Q25414|5HTR_LYMST	sp|Q25414|5HTR_LYMST 5-hydroxytryptamine receptor OS=Lymnaea stagnalis OX=6523 PE=2 SV=1
     75 sp|Q26495|OPS2_SCHGR	sp|Q26495|OPS2_SCHGR Opsin-2 OS=Schistocerca gregaria OX=7010 GN=Lo2 PE=2 SV=1
      9 sp|Q27987|TSHR_BOVIN	sp|Q27987|TSHR_BOVIN Thyrotropin receptor OS=Bos taurus OX=9913 GN=TSHR PE=2 SV=1
     37 sp|Q28003|CXCR2_BOVIN	sp|Q28003|CXCR2_BOVIN C-X-C chemokine receptor type 2 OS=Bos taurus OX=9913 GN=CXCR2 PE=2 SV=1
     24 sp|Q28005|LSHR_BOVIN	sp|Q28005|LSHR_BOVIN Lutropin-choriogonadotropic hormone receptor OS=Bos taurus OX=9913 GN=LHCGR PE=2 SV=1
     12 sp|Q28031|LPAR1_BOVIN	sp|Q28031|LPAR1_BOVIN Lysophosphatidic acid receptor 1 OS=Bos taurus OX=9913 GN=LPAR1 PE=2 SV=1
     48 sp|Q28044|ADRB2_BOVIN	sp|Q28044|ADRB2_BOVIN Beta-2 adrenergic receptor OS=Bos taurus OX=9913 GN=ADRB2 PE=2 SV=2
     33 sp|Q28309|AA3R_CANLF	sp|Q28309|AA3R_CANLF Adenosine receptor A3 OS=Canis lupus familiaris OX=9615 GN=ADORA3 PE=2 SV=1
      9 sp|Q28422|CXCR2_GORGO	sp|Q28422|CXCR2_GORGO C-X-C chemokine receptor type 2 (Fragment) OS=Gorilla gorilla gorilla OX=9595 GN=CXCR2 PE=3 SV=1
     19 sp|Q28474|CXCR4_MACFA	sp|Q28474|CXCR4_MACFA C-X-C chemokine receptor type 4 OS=Macaca fascicularis OX=9541 GN=CXCR4 PE=2 SV=2
     55 sp|Q28509|ADRB2_MACMU	sp|Q28509|ADRB2_MACMU Beta-2 adrenergic receptor OS=Macaca mulatta OX=9544 GN=ADRB2 PE=2 SV=1
     12 sp|Q28519|CXCR2_MACMU	sp|Q28519|CXCR2_MACMU C-X-C chemokine receptor type 2 (Fragment) OS=Macaca mulatta OX=9544 GN=CXCR2 PE=3 SV=1
     40 sp|Q28524|ADRB3_MACMU	sp|Q28524|ADRB3_MACMU Beta-3 adrenergic receptor OS=Macaca mulatta OX=9544 GN=ADRB3 PE=2 SV=1
      6 sp|Q28553|CXCR4_SHEEP	sp|Q28553|CXCR4_SHEEP C-X-C chemokine receptor type 4 (Fragment) OS=Ovis aries OX=9940 GN=CXCR4 PE=2 SV=1
     64 sp|Q28558|MTR1L_SHEEP	sp|Q28558|MTR1L_SHEEP Melatonin-related receptor OS=Ovis aries OX=9940 GN=GPR50 PE=2 SV=2
     16 sp|Q28585|LSHR_SHEEP	sp|Q28585|LSHR_SHEEP Lutropin-choriogonadotropic hormone receptor (Fragment) OS=Ovis aries OX=9940 GN=LHCGR PE=2 SV=1
     51 sp|Q28596|TRFR_SHEEP	sp|Q28596|TRFR_SHEEP Thyrotropin-releasing hormone receptor OS=Ovis aries OX=9940 GN=TRHR PE=2 SV=1
     32 sp|Q28642|BKRB2_RABIT	sp|Q28642|BKRB2_RABIT B2 bradykinin receptor OS=Oryctolagus cuniculus OX=9986 GN=BDKRB2 PE=3 SV=1
     30 sp|Q28691|PE2R4_RABIT	sp|Q28691|PE2R4_RABIT Prostaglandin E2 receptor EP4 subtype OS=Oryctolagus cuniculus OX=9986 GN=PTGER4 PE=2 SV=1
      8 sp|Q28756|OXYR_SHEEP	sp|Q28756|OXYR_SHEEP Oxytocin receptor OS=Ovis aries OX=9940 GN=OXTR PE=1 SV=1
     10 sp|Q28807|CXCR2_PANTR	sp|Q28807|CXCR2_PANTR C-X-C chemokine receptor type 2 (Fragment) OS=Pan troglodytes OX=9598 GN=CXCR2 PE=3 SV=2
     45 sp|Q28838|ADA2A_BOVIN	sp|Q28838|ADA2A_BOVIN Alpha-2A adrenergic receptor OS=Bos taurus OX=9913 GN=ADRA2A PE=2 SV=3
     83 sp|Q28886|OPSD_MACFA	sp|Q28886|OPSD_MACFA Rhodopsin OS=Macaca fascicularis OX=9541 GN=RHO PE=2 SV=1
     38 sp|Q28927|ADRB1_SHEEP	sp|Q28927|ADRB1_SHEEP Beta-1 adrenergic receptor OS=Ovis aries OX=9940 GN=ADRB1 PE=2 SV=2
      1 sp|Q28928|ACTHR_PAPHA	sp|Q28928|ACTHR_PAPHA Adrenocorticotropic hormone receptor (Fragment) OS=Papio hamadryas OX=9557 GN=MC2R PE=2 SV=1
      3 sp|Q28929|AGTR2_SHEEP	sp|Q28929|AGTR2_SHEEP Type-2 angiotensin II receptor (Fragment) OS=Ovis aries OX=9940 GN=AGTR2 PE=2 SV=1
     45 sp|Q28997|ADRB2_PIG	sp|Q28997|ADRB2_PIG Beta-2 adrenergic receptor OS=Sus scrofa OX=9823 GN=ADRB2 PE=2 SV=2
     36 sp|Q28998|ADRB1_PIG	sp|Q28998|ADRB1_PIG Beta-1 adrenergic receptor OS=Sus scrofa OX=9823 GN=ADRB1 PE=2 SV=2
     19 sp|Q29003|5HT1E_PIG	sp|Q29003|5HT1E_PIG 5-hydroxytryptamine receptor 1E (Fragment) OS=Sus scrofa OX=9823 GN=HTR1E PE=3 SV=1
      1 sp|Q29005|5HT2B_PIG	sp|Q29005|5HT2B_PIG 5-hydroxytryptamine receptor 2B (Fragment) OS=Sus scrofa OX=9823 GN=HTR2B PE=2 SV=1
     13 sp|Q29010|EDNRA_PIG	sp|Q29010|EDNRA_PIG Endothelin-1 receptor OS=Sus scrofa OX=9823 GN=EDNRA PE=2 SV=1
      3 sp|Q29154|MSHR_VULVU	sp|Q29154|MSHR_VULVU Melanocyte-stimulating hormone receptor OS=Vulpes vulpes OX=9627 GN=MC1R PE=3 SV=2
     40 sp|Q29J90|MOODY_DROPS	sp|Q29J90|MOODY_DROPS G-protein coupled receptor moody OS=Drosophila pseudoobscura pseudoobscura OX=46245 GN=moody PE=3 SV=2
     18 sp|Q2AC31|FFAR4_RAT	sp|Q2AC31|FFAR4_RAT Free fatty acid receptor 4 OS=Rattus norvegicus OX=10116 GN=Ffar4 PE=2 SV=1
     51 sp|Q2HJ17|CCR5_BOVIN	sp|Q2HJ17|CCR5_BOVIN C-C chemokine receptor type 5 OS=Bos taurus OX=9913 GN=CCR5 PE=2 SV=1
      4 sp|Q2HJA4|PAR2_BOVIN	sp|Q2HJA4|PAR2_BOVIN Proteinase-activated receptor 2 OS=Bos taurus OX=9913 GN=F2RL1 PE=2 SV=1
     37 sp|Q2KI97|GPR84_BOVIN	sp|Q2KI97|GPR84_BOVIN G-protein coupled receptor 84 OS=Bos taurus OX=9913 GN=GPR84 PE=2 SV=1
