     32 sp|A0A287A2K5|GASR_PIG	sp|A0A287A2K5|GASR_PIG Gastrin/cholecystokinin type B receptor OS=Sus scrofa OX=9823 GN=CCKBR PE=3 SV=1
      3 sp|A0A2R9YJI3|GPR22_DANRE	sp|A0A2R9YJI3|GPR22_DANRE G-protein coupled receptor 22 OS=Danio rerio OX=7955 GN=gpr22a PE=2 SV=1
     56 sp|A0T2N3|APJB_DANRE	sp|A0T2N3|APJB_DANRE Apelin receptor B OS=Danio rerio OX=7955 GN=aplnrb PE=1 SV=1
     17 sp|A1A5S3|GPR18_RAT	sp|A1A5S3|GPR18_RAT N-arachidonyl glycine receptor OS=Rattus norvegicus OX=10116 GN=Gpr18 PE=1 SV=1
     34 sp|A1ZAX0|CCH1R_DROME	sp|A1ZAX0|CCH1R_DROME Neuropeptide CCHamide-1 receptor OS=Drosophila melanogaster OX=7227 GN=CCHa1-R PE=2 SV=2
      1 sp|A2ARI4|LGR4_MOUSE	sp|A2ARI4|LGR4_MOUSE Leucine-rich repeat-containing G-protein coupled receptor 4 OS=Mus musculus OX=10090 GN=Lgr4 PE=1 SV=1
      1 sp|A3KFT3|OR2M5_HUMAN	sp|A3KFT3|OR2M5_HUMAN Olfactory receptor 2M5 OS=Homo sapiens OX=9606 GN=OR2M5 PE=3 SV=1
     15 sp|A4FUQ5|FPRS4_MOUSE	sp|A4FUQ5|FPRS4_MOUSE Formyl peptide receptor-related sequence 4 OS=Mus musculus OX=10090 GN=Fpr-rs4 PE=2 SV=2
     40 sp|A5A4K9|GHSR_RABIT	sp|A5A4K9|GHSR_RABIT Growth hormone secretagogue receptor type 1 OS=Oryctolagus cuniculus OX=9986 GN=GHSR PE=2 SV=1
     39 sp|A5A4L1|GHSR_MUSPF	sp|A5A4L1|GHSR_MUSPF Growth hormone secretagogue receptor type 1 OS=Mustela putorius furo OX=9669 GN=GHSR PE=2 SV=1
      7 sp|A5PLE7|GP83A_DANRE	sp|A5PLE7|GP83A_DANRE G-protein coupled receptor 183-A OS=Danio rerio OX=7955 GN=gpr183a PE=2 SV=1
      3 sp|A6NCV1|O6C74_HUMAN	sp|A6NCV1|O6C74_HUMAN Olfactory receptor 6C74 OS=Homo sapiens OX=9606 GN=OR6C74 PE=2 SV=1
      2 sp|A6ND48|O14I1_HUMAN	sp|A6ND48|O14I1_HUMAN Olfactory receptor 14I1 OS=Homo sapiens OX=9606 GN=OR14I1 PE=1 SV=1
      8 sp|A6NDL8|O6C68_HUMAN	sp|A6NDL8|O6C68_HUMAN Olfactory receptor 6C68 OS=Homo sapiens OX=9606 GN=OR6C68 PE=3 SV=2
      1 sp|A6NF89|OR6C6_HUMAN	sp|A6NF89|OR6C6_HUMAN Olfactory receptor 6C6 OS=Homo sapiens OX=9606 GN=OR6C6 PE=3 SV=1
      3 sp|A6NIJ9|O6C70_HUMAN	sp|A6NIJ9|O6C70_HUMAN Olfactory receptor 6C70 OS=Homo sapiens OX=9606 GN=OR6C70 PE=3 SV=1
      2 sp|A6NJZ3|O6C65_HUMAN	sp|A6NJZ3|O6C65_HUMAN Olfactory receptor 6C65 OS=Homo sapiens OX=9606 GN=OR6C65 PE=2 SV=1
      6 sp|A6NL08|O6C75_HUMAN	sp|A6NL08|O6C75_HUMAN Olfactory receptor 6C75 OS=Homo sapiens OX=9606 GN=OR6C75 PE=3 SV=1
      2 sp|A6NL26|OR5BL_HUMAN	sp|A6NL26|OR5BL_HUMAN Olfactory receptor 5B21 OS=Homo sapiens OX=9606 GN=OR5B21 PE=3 SV=1
      2 sp|A6NM76|O6C76_HUMAN	sp|A6NM76|O6C76_HUMAN Olfactory receptor 6C76 OS=Homo sapiens OX=9606 GN=OR6C76 PE=3 SV=1
      1 sp|A6NND4|O2AT4_HUMAN	sp|A6NND4|O2AT4_HUMAN Olfactory receptor 2AT4 OS=Homo sapiens OX=9606 GN=OR2AT4 PE=1 SV=1
     31 sp|A6QLE7|GPR52_BOVIN	sp|A6QLE7|GPR52_BOVIN G-protein coupled receptor 52 OS=Bos taurus OX=9913 GN=GPR52 PE=2 SV=1
      6 sp|A7YY44|PAR1_BOVIN	sp|A7YY44|PAR1_BOVIN Proteinase-activated receptor 1 OS=Bos taurus OX=9913 GN=F2R PE=2 SV=1
      7 sp|B0F9W3|GPER1_MICUN	sp|B0F9W3|GPER1_MICUN G-protein coupled estrogen receptor 1 OS=Micropogonias undulatus OX=29154 GN=gper1 PE=1 SV=1
     11 sp|B0UXR0|GP83B_DANRE	sp|B0UXR0|GP83B_DANRE G-protein coupled receptor 183-B OS=Danio rerio OX=7955 GN=gpr183b PE=3 SV=1
      5 sp|B0V1P1|MC4R_DANRE	sp|B0V1P1|MC4R_DANRE Melanocortin receptor 4 OS=Danio rerio OX=7955 GN=mc4r PE=1 SV=1
     18 sp|B1PHQ8|CML1_PIG	sp|B1PHQ8|CML1_PIG Chemokine-like receptor 1 OS=Sus scrofa OX=9823 GN=CMLKR1 PE=2 SV=1
      4 sp|B2GV46|FFAR3_RAT	sp|B2GV46|FFAR3_RAT Free fatty acid receptor 3 OS=Rattus norvegicus OX=10116 GN=Ffar3 PE=1 SV=1
      1 sp|B2RN74|O11HC_HUMAN	sp|B2RN74|O11HC_HUMAN Olfactory receptor 11H12 OS=Homo sapiens OX=9606 GN=OR11H12 PE=2 SV=1
     61 sp|B2RPY5|GP161_MOUSE	sp|B2RPY5|GP161_MOUSE G-protein coupled receptor 161 OS=Mus musculus OX=10090 GN=Gpr161 PE=1 SV=1
      8 sp|B2ZHY2|GPR39_PIG	sp|B2ZHY2|GPR39_PIG G-protein coupled receptor 39 OS=Sus scrofa OX=9823 GN=GPR39 PE=2 SV=1
     63 sp|B3DM66|GP161_XENTR	sp|B3DM66|GP161_XENTR G-protein coupled receptor 161 OS=Xenopus tropicalis OX=8364 GN=gpr161 PE=2 SV=1
     12 sp|B3G515|GPER1_DANRE	sp|B3G515|GPER1_DANRE G-protein coupled estrogen receptor 1 OS=Danio rerio OX=7955 GN=gper1 PE=1 SV=1
      3 sp|B4XF06|GPR39_BOVIN	sp|B4XF06|GPR39_BOVIN G-protein coupled receptor 39 OS=Bos taurus OX=9913 GN=GPR39 PE=2 SV=1
     15 sp|B5X337|GP183_SALSA	sp|B5X337|GP183_SALSA G-protein coupled receptor 183 OS=Salmo salar OX=8030 GN=gpr183 PE=2 SV=1
     27 sp|B9VR26|CML1_BOVIN	sp|B9VR26|CML1_BOVIN Chemokine-like receptor 1 OS=Bos taurus OX=9913 GN=CMLKR1 PE=2 SV=1
     61 sp|C3ZQF9|QRFPR_BRAFL	sp|C3ZQF9|QRFPR_BRAFL QRFP-like peptide receptor OS=Branchiostoma floridae OX=7739 GN=QRFPR PE=3 SV=1
     12 sp|C8YUV0|FFAR4_MACFA	sp|C8YUV0|FFAR4_MACFA Free fatty acid receptor 4 OS=Macaca fascicularis OX=9541 GN=FFAR4 PE=2 SV=1
      7 sp|D4A3U0|GPR22_RAT	sp|D4A3U0|GPR22_RAT G-protein coupled receptor 22 OS=Rattus norvegicus OX=10116 GN=Gpr22 PE=1 SV=2
     23 sp|D4A7K7|GP183_RAT	sp|D4A7K7|GP183_RAT G-protein coupled receptor 183 OS=Rattus norvegicus OX=10116 GN=Gpr183 PE=3 SV=1
      5 sp|D4AC13|LGR5_RAT	sp|D4AC13|LGR5_RAT Leucine-rich repeat-containing G-protein coupled receptor 5 OS=Rattus norvegicus OX=10116 GN=Lgr5 PE=3 SV=1
     47 sp|E7EM37|DOPR2_CAEEL	sp|E7EM37|DOPR2_CAEEL Dopamine receptor 2 OS=Caenorhabditis elegans OX=6239 GN=dop-2 PE=1 SV=1
     62 sp|E7F7V7|GAL2B_DANRE	sp|E7F7V7|GAL2B_DANRE Galanin receptor 2b OS=Danio rerio OX=7955 GN=galr2b PE=2 SV=1
     38 sp|E9QJ73|CXR32_DANRE	sp|E9QJ73|CXR32_DANRE C-X-C chemokine receptor type 3-2 OS=Danio rerio OX=7955 GN=cxcr3.2 PE=2 SV=2
     58 sp|F1MV99|SSR5_BOVIN	sp|F1MV99|SSR5_BOVIN Somatostatin receptor type 5 OS=Bos taurus OX=9913 GN=SSTR5 PE=3 SV=2
     65 sp|F1R332|GAL2A_DANRE	sp|F1R332|GAL2A_DANRE Galanin receptor 2a OS=Danio rerio OX=7955 GN=galr2a PE=2 SV=2
      6 sp|F5HF62|US28_HCMVM	sp|F5HF62|US28_HCMVM Envelope protein US28 OS=Human cytomegalovirus (strain Merlin) OX=295027 GN=US28 PE=3 SV=1
     19 sp|F7EQ49|GPER1_MACMU	sp|F7EQ49|GPER1_MACMU G-protein coupled estrogen receptor 1 OS=Macaca mulatta OX=9544 GN=GPER1 PE=1 SV=1
      9 sp|F8VQN3|GPR31_MOUSE	sp|F8VQN3|GPR31_MOUSE 12-(S)-hydroxy-5,8,10,14-eicosatetraenoic acid receptor OS=Mus musculus OX=10090 GN=Gpr31 PE=3 SV=1
     63 sp|G3M4F8|OCTB2_CHISP	sp|G3M4F8|OCTB2_CHISP Octopamine receptor beta-2R OS=Chilo suppressalis OX=168631 GN=OA2B2 PE=2 SV=1
     53 sp|G4WMX4|RYAR_TRICA	sp|G4WMX4|RYAR_TRICA RYamide receptor OS=Tribolium castaneum OX=7070 GN=RYa-R PE=2 SV=1
      8 sp|O00155|GPR25_HUMAN	sp|O00155|GPR25_HUMAN Probable G-protein coupled receptor 25 OS=Homo sapiens OX=9606 GN=GPR25 PE=1 SV=2
     13 sp|O00254|PAR3_HUMAN	sp|O00254|PAR3_HUMAN Proteinase-activated receptor 3 OS=Homo sapiens OX=9606 GN=F2RL2 PE=1 SV=1
      8 sp|O00270|GPR31_HUMAN	sp|O00270|GPR31_HUMAN 12-(S)-hydroxy-5,8,10,14-eicosatetraenoic acid receptor OS=Homo sapiens OX=9606 GN=GPR31 PE=1 SV=2
      3 sp|O00398|P2Y10_HUMAN	sp|O00398|P2Y10_HUMAN Putative P2Y purinoceptor 10 OS=Homo sapiens OX=9606 GN=P2RY10 PE=2 SV=1
     13 sp|O00421|CCRL2_HUMAN	sp|O00421|CCRL2_HUMAN C-C chemokine receptor-like 2 OS=Homo sapiens OX=9606 GN=CCRL2 PE=1 SV=2
     19 sp|O00574|CXCR6_HUMAN	sp|O00574|CXCR6_HUMAN C-X-C chemokine receptor type 6 OS=Homo sapiens OX=9606 GN=CXCR6 PE=2 SV=1
     82 sp|O01668|OPS6_DROME	sp|O01668|OPS6_DROME Opsin Rh6 OS=Drosophila melanogaster OX=7227 GN=Rh6 PE=2 SV=1
     53 sp|O01670|OAR2_LYMST	sp|O01670|OAR2_LYMST Octopamine receptor 2 OS=Lymnaea stagnalis OX=6523 PE=1 SV=1
     49 sp|O02213|SER2_CAEEL	sp|O02213|SER2_CAEEL Tyramine receptor Ser-2 OS=Caenorhabditis elegans OX=6239 GN=ser-2 PE=1 SV=4
      6 sp|O02300|NTR1_CAEEL	sp|O02300|NTR1_CAEEL Nematocin receptor 1 OS=Caenorhabditis elegans OX=6239 GN=ntr-1 PE=2 SV=1
     83 sp|O02464|OPS1_MANSE	sp|O02464|OPS1_MANSE Opsin-1 OS=Manduca sexta OX=7130 GN=OP1 PE=1 SV=2
     74 sp|O02465|OPS2_MANSE	sp|O02465|OPS2_MANSE Opsin-2 OS=Manduca sexta OX=7130 GN=OP2 PE=2 SV=2
     43 sp|O02662|ADRB3_CANLF	sp|O02662|ADRB3_CANLF Beta-3 adrenergic receptor OS=Canis lupus familiaris OX=9615 GN=ADRB3 PE=2 SV=1
     19 sp|O02664|DRD1_RABIT	sp|O02664|DRD1_RABIT D(1A) dopamine receptor (Fragment) OS=Oryctolagus cuniculus OX=9986 GN=DRD1 PE=3 SV=1
     38 sp|O02666|ADA1D_RABIT	sp|O02666|ADA1D_RABIT Alpha-1D adrenergic receptor OS=Oryctolagus cuniculus OX=9986 GN=ADRA1D PE=2 SV=1
     39 sp|O02667|AA3R_RABIT	sp|O02667|AA3R_RABIT Adenosine receptor A3 OS=Oryctolagus cuniculus OX=9986 GN=ADORA3 PE=2 SV=1
     27 sp|O02721|LSHR_CALJA	sp|O02721|LSHR_CALJA Lutropin-choriogonadotropic hormone receptor OS=Callithrix jacchus OX=9483 GN=LHCGR PE=2 SV=1
     29 sp|O02769|MTR1A_BOVIN	sp|O02769|MTR1A_BOVIN Melatonin receptor type 1A (Fragment) OS=Bos taurus OX=9913 GN=MTNR1A PE=3 SV=1
     21 sp|O02777|CNR1_FELCA	sp|O02777|CNR1_FELCA Cannabinoid receptor 1 OS=Felis catus OX=9685 GN=CNR1 PE=1 SV=1
     64 sp|O02813|NPY1R_CANLF	sp|O02813|NPY1R_CANLF Neuropeptide Y receptor type 1 OS=Canis lupus familiaris OX=9615 GN=NPY1R PE=2 SV=2
     63 sp|O02824|ADA1A_RABIT	sp|O02824|ADA1A_RABIT Alpha-1A adrenergic receptor OS=Oryctolagus cuniculus OX=9986 GN=ADRA1A PE=2 SV=1
     62 sp|O02835|NPY1R_PIG	sp|O02835|NPY1R_PIG Neuropeptide Y receptor type 1 OS=Sus scrofa OX=9823 GN=NPY1R PE=2 SV=2
     55 sp|O02836|NPY2R_PIG	sp|O02836|NPY2R_PIG Neuropeptide Y receptor type 2 OS=Sus scrofa OX=9823 GN=NPY2R PE=2 SV=2
     28 sp|O08530|S1PR1_MOUSE	sp|O08530|S1PR1_MOUSE Sphingosine 1-phosphate receptor 1 OS=Mus musculus OX=10090 GN=S1pr1 PE=1 SV=3
     40 sp|O08556|CCR5_RAT	sp|O08556|CCR5_RAT C-C chemokine receptor type 5 OS=Rattus norvegicus OX=10116 GN=Ccr5 PE=2 SV=1
     18 sp|O08565|CXCR4_RAT	sp|O08565|CXCR4_RAT C-X-C chemokine receptor type 4 OS=Rattus norvegicus OX=10116 GN=Cxcr4 PE=1 SV=2
      7 sp|O08675|PAR3_MOUSE	sp|O08675|PAR3_MOUSE Proteinase-activated receptor 3 OS=Mus musculus OX=10090 GN=F2rl2 PE=1 SV=2
      1 sp|O08707|ACKR2_MOUSE	sp|O08707|ACKR2_MOUSE Atypical chemokine receptor 2 OS=Mus musculus OX=10090 GN=Ackr2 PE=1 SV=2
     39 sp|O08725|GHSR_RAT	sp|O08725|GHSR_RAT Growth hormone secretagogue receptor type 1 OS=Rattus norvegicus OX=10116 GN=Ghsr PE=2 SV=1
     61 sp|O08726|GALR2_RAT	sp|O08726|GALR2_RAT Galanin receptor type 2 OS=Rattus norvegicus OX=10116 GN=Galr2 PE=2 SV=1
     39 sp|O08786|CCKAR_MOUSE	sp|O08786|CCKAR_MOUSE Cholecystokinin receptor type A OS=Mus musculus OX=10090 GN=Cckar PE=1 SV=1
      6 sp|O08790|FPRS1_MOUSE	sp|O08790|FPRS1_MOUSE Formyl peptide receptor-related sequence 1 OS=Mus musculus OX=10090 GN=Fpr-s1 PE=1 SV=2
     45 sp|O08858|SSR5_MOUSE	sp|O08858|SSR5_MOUSE Somatostatin receptor type 5 OS=Mus musculus OX=10090 GN=Sstr5 PE=1 SV=3
     16 sp|O08878|GPER1_RAT	sp|O08878|GPER1_RAT G-protein coupled estrogen receptor 1 OS=Rattus norvegicus OX=10116 GN=Gper1 PE=1 SV=1
     42 sp|O08890|5HT1F_CAVPO	sp|O08890|5HT1F_CAVPO 5-hydroxytryptamine receptor 1F OS=Cavia porcellus OX=10141 GN=HTR1F PE=3 SV=1
     43 sp|O08892|5HT1B_CAVPO	sp|O08892|5HT1B_CAVPO 5-hydroxytryptamine receptor 1B OS=Cavia porcellus OX=10141 GN=HTR1B PE=3 SV=1
      7 sp|O09027|ACKR2_RAT	sp|O09027|ACKR2_RAT Atypical chemokine receptor 2 OS=Rattus norvegicus OX=10116 GN=Ackr2 PE=2 SV=1
     81 sp|O12948|OPSR_XENLA	sp|O12948|OPSR_XENLA Red-sensitive opsin OS=Xenopus laevis OX=8355 GN=opn1lw1 PE=2 SV=1
     83 sp|O13018|OPSO_SALSA	sp|O13018|OPSO_SALSA Vertebrate ancient opsin OS=Salmo salar OX=8030 PE=1 SV=1
     51 sp|O13076|AA2BR_CHICK	sp|O13076|AA2BR_CHICK Adenosine receptor A2b OS=Gallus gallus OX=9031 GN=ADORA2B PE=2 SV=1
     82 sp|O13092|OPSB_SAIBB	sp|O13092|OPSB_SAIBB Short-wave-sensitive opsin 1 OS=Saimiri boliviensis boliviensis OX=39432 GN=OPN1SW PE=1 SV=1
     83 sp|O13227|OPSB_CONCO	sp|O13227|OPSB_CONCO Blue-sensitive opsin OS=Conger conger OX=82655 PE=1 SV=1
      2 sp|O14581|OR7AH_HUMAN	sp|O14581|OR7AH_HUMAN Olfactory receptor 7A17 OS=Homo sapiens OX=9606 GN=OR7A17 PE=1 SV=1
     84 sp|O14718|OPSX_HUMAN	sp|O14718|OPSX_HUMAN Visual pigment-like receptor peropsin OS=Homo sapiens OX=9606 GN=RRH PE=1 SV=1
     42 sp|O14804|TAAR5_HUMAN	sp|O14804|TAAR5_HUMAN Trace amine-associated receptor 5 OS=Homo sapiens OX=9606 GN=TAAR5 PE=2 SV=2
      7 sp|O14843|FFAR3_HUMAN	sp|O14843|FFAR3_HUMAN Free fatty acid receptor 3 OS=Homo sapiens OX=9606 GN=FFAR3 PE=1 SV=1
      6 sp|O15218|GP182_HUMAN	sp|O15218|GP182_HUMAN G-protein coupled receptor 182 OS=Homo sapiens OX=9606 GN=GPR182 PE=2 SV=1
      5 sp|O15354|GPR37_HUMAN	sp|O15354|GPR37_HUMAN Prosaposin receptor GPR37 OS=Homo sapiens OX=9606 GN=GPR37 PE=1 SV=2
      6 sp|O15529|GPR42_HUMAN	sp|O15529|GPR42_HUMAN G-protein coupled receptor 42 OS=Homo sapiens OX=9606 GN=GPR42 PE=1 SV=1
     84 sp|O15973|OPSD1_MIZYE	sp|O15973|OPSD1_MIZYE Rhodopsin, GQ-coupled OS=Mizuhopecten yessoensis OX=6573 GN=SCOP1 PE=1 SV=1
     83 sp|O15974|OPSD2_MIZYE	sp|O15974|OPSD2_MIZYE Rhodopsin, G0-coupled OS=Mizuhopecten yessoensis OX=6573 GN=SCOP2 PE=1 SV=1
     83 sp|O16005|OPSD_SEPOF	sp|O16005|OPSD_SEPOF Rhodopsin OS=Sepia officinalis OX=6610 GN=RHO PE=2 SV=1
     80 sp|O16017|OPSD_LACLU	sp|O16017|OPSD_LACLU Rhodopsin (Fragment) OS=Lacunicambarus ludovicianus OX=2315848 GN=RHO PE=3 SV=1
     80 sp|O16018|OPSD_CAMSC	sp|O16018|OPSD_CAMSC Rhodopsin (Fragment) OS=Cambarellus shufeldtii OX=60963 GN=RHO PE=3 SV=1
     81 sp|O16019|OPSD_ORCVI	sp|O16019|OPSD_ORCVI Rhodopsin (Fragment) OS=Orconectes virilis OX=60966 GN=RHO PE=3 SV=1
     81 sp|O16020|OPSD_PROML	sp|O16020|OPSD_PROML Rhodopsin (Fragment) OS=Procambarus milleri OX=60967 GN=RHO PE=3 SV=1
     78 sp|O18312|OPSD_CAMHU	sp|O18312|OPSD_CAMHU Rhodopsin (Fragment) OS=Cambarus hubrichti OX=61487 GN=RHO PE=3 SV=1
     80 sp|O18315|OPSD_CAMMA	sp|O18315|OPSD_CAMMA Rhodopsin (Fragment) OS=Cambarus maculatus OX=61489 GN=RHO PE=3 SV=1
     81 sp|O18481|OPSD_ORCAU	sp|O18481|OPSD_ORCAU Rhodopsin (Fragment) OS=Orconectes australis OX=61490 GN=RHO PE=3 SV=1
     81 sp|O18485|OPSD_PROOR	sp|O18485|OPSD_PROOR Rhodopsin (Fragment) OS=Procambarus orcinus OX=61504 GN=RHO PE=3 SV=1
     80 sp|O18486|OPSD_PROSE	sp|O18486|OPSD_PROSE Rhodopsin (Fragment) OS=Procambarus seminolae OX=61505 GN=RHO PE=3 SV=1
     82 sp|O18766|OPSD_PIG	sp|O18766|OPSD_PIG Rhodopsin OS=Sus scrofa OX=9823 GN=RHO PE=1 SV=1
     44 sp|O18793|CCR2_MACMU	sp|O18793|CCR2_MACMU C-C chemokine receptor type 2 OS=Macaca mulatta OX=9544 GN=CCR2 PE=2 SV=2
      7 sp|O18821|GNRHR_HORSE	sp|O18821|GNRHR_HORSE Gonadotropin-releasing hormone receptor OS=Equus caballus OX=9796 GN=GNRHR PE=2 SV=3
     81 sp|O18910|OPSG_RABIT	sp|O18910|OPSG_RABIT Medium-wave-sensitive opsin 1 OS=Oryctolagus cuniculus OX=9986 GN=OPN1MW PE=1 SV=2
     80 sp|O18911|OPSG_ODOVI	sp|O18911|OPSG_ODOVI Medium-wave-sensitive opsin 1 (Fragment) OS=Odocoileus virginianus virginianus OX=9875 GN=OPN1MW PE=1 SV=1
     82 sp|O18912|OPSR_HORSE	sp|O18912|OPSR_HORSE Long-wave-sensitive opsin 1 OS=Equus caballus OX=9796 GN=OPN1LW PE=1 SV=2
     81 sp|O18913|OPSR_FELCA	sp|O18913|OPSR_FELCA Long-wave-sensitive opsin 1 OS=Felis catus OX=9685 GN=OPN1LW PE=1 SV=2
     81 sp|O18914|OPSR_CANLF	sp|O18914|OPSR_CANLF Long-wave-sensitive opsin 1 OS=Canis lupus familiaris OX=9615 GN=OPN1LW PE=2 SV=2
     51 sp|O18935|ADA2B_AMBHO	sp|O18935|ADA2B_AMBHO Alpha-2B adrenergic receptor (Fragment) OS=Amblysomus hottentotus OX=9391 GN=ADRA2B PE=3 SV=2
     16 sp|O18982|GPR15_CHLAE	sp|O18982|GPR15_CHLAE G-protein coupled receptor 15 OS=Chlorocebus aethiops OX=9534 GN=GPR15 PE=3 SV=1
     22 sp|O18983|CXCR6_CHLAE	sp|O18983|CXCR6_CHLAE C-X-C chemokine receptor type 6 OS=Chlorocebus aethiops OX=9534 GN=CXCR6 PE=3 SV=1
     48 sp|O19012|ADA2B_ERIEU	sp|O19012|ADA2B_ERIEU Alpha-2B adrenergic receptor (Fragment) OS=Erinaceus europaeus OX=9365 GN=ADRA2B PE=3 SV=1
     49 sp|O19014|ADA2B_ELEMA	sp|O19014|ADA2B_ELEMA Alpha-2B adrenergic receptor (Fragment) OS=Elephas maximus OX=9783 GN=ADRA2B PE=3 SV=1
     21 sp|O19024|CXCR6_MACNE	sp|O19024|CXCR6_MACNE C-X-C chemokine receptor type 6 OS=Macaca nemestrina OX=9545 GN=CXCR6 PE=3 SV=1
     51 sp|O19025|ADA2B_MACPR	sp|O19025|ADA2B_MACPR Alpha-2B adrenergic receptor (Fragment) OS=Macroscelides proboscideus OX=29082 GN=ADRA2B PE=3 SV=2
     49 sp|O19032|ADA2B_ORYAF	sp|O19032|ADA2B_ORYAF Alpha-2B adrenergic receptor (Fragment) OS=Orycteropus afer OX=9818 GN=ADRA2B PE=3 SV=1
      6 sp|O19037|MSHR_SHEEP	sp|O19037|MSHR_SHEEP Melanocyte-stimulating hormone receptor OS=Ovis aries OX=9940 GN=MC1R PE=3 SV=1
     45 sp|O19054|ADA2B_PROHA	sp|O19054|ADA2B_PROHA Alpha-2B adrenergic receptor (Fragment) OS=Procavia capensis habessinica OX=9814 GN=ADRA2B PE=3 SV=1
     40 sp|O19091|ADA2B_TALEU	sp|O19091|ADA2B_TALEU Alpha-2B adrenergic receptor (Fragment) OS=Talpa europaea OX=9375 GN=ADRA2B PE=3 SV=1
     47 sp|O35210|AGTR1_MERUN	sp|O35210|AGTR1_MERUN Type-1 angiotensin II receptor OS=Meriones unguiculatus OX=10047 GN=AGTR1 PE=2 SV=1
     84 sp|O35214|OPSX_MOUSE	sp|O35214|OPSX_MOUSE Visual pigment-like receptor peropsin OS=Mus musculus OX=10090 GN=Rrh PE=1 SV=1
     80 sp|O35476|OPSG_RAT	sp|O35476|OPSG_RAT Medium-wave-sensitive opsin 1 OS=Rattus norvegicus OX=10116 GN=Opn1mw PE=1 SV=2
     81 sp|O35478|OPSG_SCICA	sp|O35478|OPSG_SCICA Medium-wave-sensitive opsin 1 OS=Sciurus carolinensis OX=30640 GN=OPN1MW PE=1 SV=2
     80 sp|O35599|OPSG_MOUSE	sp|O35599|OPSG_MOUSE Medium-wave-sensitive opsin 1 OS=Mus musculus OX=10090 GN=Opn1mw PE=1 SV=1
     27 sp|O35786|CML1_RAT	sp|O35786|CML1_RAT Chemokine-like receptor 1 OS=Rattus norvegicus OX=10116 GN=Cmklr1 PE=1 SV=1
      4 sp|O35811|P2RY4_RAT	sp|O35811|P2RY4_RAT P2Y purinoceptor 4 OS=Rattus norvegicus OX=10116 GN=P2ry4 PE=2 SV=1
     18 sp|O42179|SSRL_TAKRU	sp|O42179|SSRL_TAKRU Somatostatin-like receptor F_48D10.1 OS=Takifugu rubripes OX=31033 GN=F_48D10.1 PE=3 SV=1
     82 sp|O42266|OPSP_ICTPU	sp|O42266|OPSP_ICTPU Parapinopsin OS=Ictalurus punctatus OX=7998 PE=2 SV=1
     82 sp|O42268|OPSD_ICTPU	sp|O42268|OPSD_ICTPU Rhodopsin (Fragment) OS=Ictalurus punctatus OX=7998 GN=rho PE=2 SV=1
     82 sp|O42294|OPSD_ABYKO	sp|O42294|OPSD_ABYKO Rhodopsin (Fragment) OS=Abyssocottus korotneffi OX=61637 GN=rho PE=3 SV=1
     82 sp|O42300|OPSD_BATMU	sp|O42300|OPSD_BATMU Rhodopsin (Fragment) OS=Batrachocottus multiradiatus OX=61628 GN=rho PE=3 SV=1
     82 sp|O42301|OPSD_BATNI	sp|O42301|OPSD_BATNI Rhodopsin (Fragment) OS=Batrachocottus nikolskii OX=79686 GN=rho PE=3 SV=1
     82 sp|O42307|OPSD_COTBO	sp|O42307|OPSD_COTBO Rhodopsin (Fragment) OS=Cottinella boulengeri OX=61639 GN=rho PE=3 SV=1
     82 sp|O42327|OPSD_COMDY	sp|O42327|OPSD_COMDY Rhodopsin (Fragment) OS=Comephorus dybowskii OX=61641 GN=rho PE=3 SV=1
     82 sp|O42328|OPSD_COTGR	sp|O42328|OPSD_COTGR Rhodopsin (Fragment) OS=Cottocomephorus grewingkii OX=57734 GN=rho PE=3 SV=1
     41 sp|O42329|GNRR2_CLAGA	sp|O42329|GNRR2_CLAGA Gonadotropin-releasing hormone II receptor OS=Clarias gariepinus OX=13013 PE=2 SV=2
     82 sp|O42330|OPSD_COTIN	sp|O42330|OPSD_COTIN Rhodopsin (Fragment) OS=Cottocomephorus inermis OX=61627 GN=rho PE=3 SV=1
     34 sp|O42384|5H1AB_TAKRU	sp|O42384|5H1AB_TAKRU 5-hydroxytryptamine receptor 1A-beta OS=Takifugu rubripes OX=31033 GN=htr1a-B PE=3 SV=1
     50 sp|O42385|5H1AA_TAKRU	sp|O42385|5H1AA_TAKRU 5-hydroxytryptamine receptor 1A-alpha OS=Takifugu rubripes OX=31033 GN=htr1aa PE=3 SV=1
     80 sp|O42427|OPSD_LIMBE	sp|O42427|OPSD_LIMBE Rhodopsin (Fragment) OS=Limnocottus bergianus OX=61633 GN=rho PE=3 SV=1
     81 sp|O42431|OPSD_LIMPA	sp|O42431|OPSD_LIMPA Rhodopsin (Fragment) OS=Limnocottus pallidus OX=61634 GN=rho PE=3 SV=1
     82 sp|O42451|OPSD_PROJE	sp|O42451|OPSD_PROJE Rhodopsin (Fragment) OS=Procottus jeittelesii OX=61631 GN=rho PE=3 SV=1
     80 sp|O42452|OPSD_PARKN	sp|O42452|OPSD_PARKN Rhodopsin (Fragment) OS=Paracottus knerii OX=61626 GN=rho PE=3 SV=1
     81 sp|O42466|OPSD_TAUBU	sp|O42466|OPSD_TAUBU Rhodopsin (Fragment) OS=Taurulus bubalis OX=61643 GN=rho PE=3 SV=1
     82 sp|O42490|OPSP_PETMA	sp|O42490|OPSP_PETMA Pineal opsin OS=Petromyzon marinus OX=7757 PE=1 SV=1
     54 sp|O42574|ADRB1_XENLA	sp|O42574|ADRB1_XENLA Beta-1 adrenergic receptor OS=Xenopus laevis OX=8355 GN=adrb1 PE=2 SV=1
     82 sp|O42604|OPSD_ZEUFA	sp|O42604|OPSD_ZEUFA Rhodopsin OS=Zeus faber OX=64108 GN=rho PE=1 SV=1
     14 sp|O43193|MTLR_HUMAN	sp|O43193|MTLR_HUMAN Motilin receptor OS=Homo sapiens OX=9606 GN=MLNR PE=2 SV=1
      4 sp|O43194|GPR39_HUMAN	sp|O43194|GPR39_HUMAN G-protein coupled receptor 39 OS=Homo sapiens OX=9606 GN=GPR39 PE=1 SV=1
     58 sp|O43603|GALR2_HUMAN	sp|O43603|GALR2_HUMAN Galanin receptor type 2 OS=Homo sapiens OX=9606 GN=GALR2 PE=1 SV=1
     31 sp|O43613|OX1R_HUMAN	sp|O43613|OX1R_HUMAN Orexin receptor type 1 OS=Homo sapiens OX=9606 GN=HCRTR1 PE=1 SV=2
     39 sp|O43614|OX2R_HUMAN	sp|O43614|OX2R_HUMAN Orexin receptor type 2 OS=Homo sapiens OX=9606 GN=HCRTR2 PE=1 SV=2
      1 sp|O43749|OR1F1_HUMAN	sp|O43749|OR1F1_HUMAN Olfactory receptor 1F1 OS=Homo sapiens OX=9606 GN=OR1F1 PE=2 SV=1
      1 sp|O43869|OR2T1_HUMAN	sp|O43869|OR2T1_HUMAN Olfactory receptor 2T1 OS=Homo sapiens OX=9606 GN=OR2T1 PE=3 SV=3
     38 sp|O46635|5HT2A_CANLF	sp|O46635|5HT2A_CANLF 5-hydroxytryptamine receptor 2A OS=Canis lupus familiaris OX=9615 GN=HTR2A PE=2 SV=2
     51 sp|O46639|TRFR_BOVIN	sp|O46639|TRFR_BOVIN Thyrotropin-releasing hormone receptor OS=Bos taurus OX=9913 GN=TRHR PE=3 SV=1
     10 sp|O46685|OGR1_BOVIN	sp|O46685|OGR1_BOVIN Ovarian cancer G-protein coupled receptor 1 OS=Bos taurus OX=9913 GN=GPR68 PE=2 SV=1
     35 sp|O54689|CCR6_MOUSE	sp|O54689|CCR6_MOUSE C-C chemokine receptor type 6 OS=Mus musculus OX=10090 GN=Ccr6 PE=1 SV=1
     50 sp|O54798|BRS3_MOUSE	sp|O54798|BRS3_MOUSE Bombesin receptor subtype-3 OS=Mus musculus OX=10090 GN=Brs3 PE=2 SV=1
     45 sp|O54799|NMBR_MOUSE	sp|O54799|NMBR_MOUSE Neuromedin-B receptor OS=Mus musculus OX=10090 GN=Nmbr PE=1 SV=1
     47 sp|O54814|CCR3_RAT	sp|O54814|CCR3_RAT C-C chemokine receptor type 3 OS=Rattus norvegicus OX=10116 GN=Ccr3 PE=2 SV=1
     42 sp|O55040|NMUR1_MOUSE	sp|O55040|NMUR1_MOUSE Neuromedin-U receptor 1 OS=Mus musculus OX=10090 GN=Nmur1 PE=2 SV=2
     41 sp|O55193|CCR2_RAT	sp|O55193|CCR2_RAT C-C chemokine receptor type 2 OS=Rattus norvegicus OX=10116 GN=Ccr2 PE=2 SV=1
      1 sp|O55197|C3AR_RAT	sp|O55197|C3AR_RAT C3a anaphylatoxin chemotactic receptor OS=Rattus norvegicus OX=10116 GN=C3ar1 PE=1 SV=1
     83 sp|O57422|OPN4B_XENLA	sp|O57422|OPN4B_XENLA Melanopsin-B OS=Xenopus laevis OX=8355 GN=opn4b PE=2 SV=1
     82 sp|O57605|OPSUV_MELUD	sp|O57605|OPSUV_MELUD Ultraviolet-sensitive opsin OS=Melopsittacus undulatus OX=13146 PE=1 SV=1
      1 sp|O60404|O10H3_HUMAN	sp|O60404|O10H3_HUMAN Olfactory receptor 10H3 OS=Homo sapiens OX=9606 GN=OR10H3 PE=2 SV=1
      1 sp|O60412|OR7C2_HUMAN	sp|O60412|OR7C2_HUMAN Olfactory receptor 7C2 OS=Homo sapiens OX=9606 GN=OR7C2 PE=1 SV=4
      2 sp|O60431|OR1I1_HUMAN	sp|O60431|OR1I1_HUMAN Olfactory receptor 1I1 OS=Homo sapiens OX=9606 GN=OR1I1 PE=2 SV=1
     18 sp|O60755|GALR3_HUMAN	sp|O60755|GALR3_HUMAN Galanin receptor type 3 OS=Homo sapiens OX=9606 GN=GALR3 PE=1 SV=1
      4 sp|O60883|G37L1_HUMAN	sp|O60883|G37L1_HUMAN G-protein coupled receptor 37-like 1 OS=Homo sapiens OX=9606 GN=GPR37L1 PE=1 SV=2
     77 sp|O61303|OPSUV_APIME	sp|O61303|OPSUV_APIME Opsin, ultraviolet-sensitive OS=Apis mellifera OX=7460 GN=UVOP PE=1 SV=1
      5 sp|O62169|NTR2_CAEEL	sp|O62169|NTR2_CAEEL Nematocin receptor 2 OS=Caenorhabditis elegans OX=6239 GN=ntr-2 PE=2 SV=1
     27 sp|O62709|EDNRB_HORSE	sp|O62709|EDNRB_HORSE Endothelin receptor type B OS=Equus caballus OX=9796 GN=EDNRB PE=1 SV=2
     34 sp|O62729|NPY5R_CANLF	sp|O62729|NPY5R_CANLF Neuropeptide Y receptor type 5 OS=Canis lupus familiaris OX=9615 GN=NPY5R PE=2 SV=1
     44 sp|O62743|CCR5_CERAT	sp|O62743|CCR5_CERAT C-C chemokine receptor type 5 OS=Cercocebus atys OX=9531 GN=CCR5 PE=3 SV=2
     18 sp|O62747|CXCR4_CERAT	sp|O62747|CXCR4_CERAT C-X-C chemokine receptor type 4 OS=Cercocebus atys OX=9531 GN=CXCR4 PE=2 SV=1
     83 sp|O62791|OPSD_DELDE	sp|O62791|OPSD_DELDE Rhodopsin OS=Delphinus delphis OX=9728 GN=RHO PE=2 SV=1
     81 sp|O62792|OPSD_GLOME	sp|O62792|OPSD_GLOME Rhodopsin OS=Globicephala melas OX=9731 GN=RHO PE=2 SV=1
     82 sp|O62793|OPSD_MESBI	sp|O62793|OPSD_MESBI Rhodopsin OS=Mesoplodon bidens OX=48745 GN=RHO PE=2 SV=1
     83 sp|O62794|OPSD_PHOVI	sp|O62794|OPSD_PHOVI Rhodopsin OS=Phoca vitulina OX=9720 GN=RHO PE=2 SV=1
     83 sp|O62795|OPSD_PAGGO	sp|O62795|OPSD_PAGGO Rhodopsin OS=Pagophilus groenlandicus OX=39089 GN=RHO PE=2 SV=1
     82 sp|O62796|OPSD_TRIMA	sp|O62796|OPSD_TRIMA Rhodopsin OS=Trichechus manatus OX=9778 GN=RHO PE=2 SV=1
     82 sp|O62798|OPSD_TURTR	sp|O62798|OPSD_TURTR Rhodopsin OS=Tursiops truncatus OX=9739 GN=RHO PE=1 SV=1
     39 sp|O62809|OX2R_PIG	sp|O62809|OX2R_PIG Orexin receptor type 2 OS=Sus scrofa OX=9823 GN=HCRTR2 PE=2 SV=2
      7 sp|O70129|C5AR1_CAVPO	sp|O70129|C5AR1_CAVPO C5a anaphylatoxin chemotactic receptor 1 OS=Cavia porcellus OX=10141 GN=C5AR1 PE=2 SV=1
     35 sp|O70342|NPY5R_MOUSE	sp|O70342|NPY5R_MOUSE Neuropeptide Y receptor type 5 OS=Mus musculus OX=10090 GN=Npy5r PE=2 SV=2
     23 sp|O70431|ADRB2_MERUN	sp|O70431|ADRB2_MERUN Beta-2 adrenergic receptor (Fragment) OS=Meriones unguiculatus OX=10047 GN=ADRB2 PE=2 SV=1
     31 sp|O70526|BKRB2_CAVPO	sp|O70526|BKRB2_CAVPO B2 bradykinin receptor OS=Cavia porcellus OX=10141 GN=BDKRB2 PE=2 SV=1
     52 sp|O70528|5HT4R_CAVPO	sp|O70528|5HT4R_CAVPO 5-hydroxytryptamine receptor 4 OS=Cavia porcellus OX=10141 GN=HTR4 PE=2 SV=1
     27 sp|O73810|DRD2_MELGA	sp|O73810|DRD2_MELGA D(2) dopamine receptor OS=Meleagris gallopavo OX=9103 GN=DRD2 PE=2 SV=1
      5 sp|O75388|GPR32_HUMAN	sp|O75388|GPR32_HUMAN Probable G-protein coupled receptor 32 OS=Homo sapiens OX=9606 GN=GPR32 PE=2 SV=1
      1 sp|O76000|OR2B3_HUMAN	sp|O76000|OR2B3_HUMAN Putative olfactory receptor 2B3 OS=Homo sapiens OX=9606 GN=OR2B3 PE=3 SV=1
      1 sp|O76002|OR2J2_HUMAN	sp|O76002|OR2J2_HUMAN Olfactory receptor 2J2 OS=Homo sapiens OX=9606 GN=OR2J2 PE=2 SV=1
      3 sp|O76099|OR7C1_HUMAN	sp|O76099|OR7C1_HUMAN Olfactory receptor 7C1 OS=Homo sapiens OX=9606 GN=OR7C1 PE=2 SV=1
